Improvement of Food Systems Supply Service in Rural Tanzania in Adaptation to COVID-19 Project,,,,,,AHAI.1/LET/AB/2021/09/07/003,,Tanzania,Under Preperation,Public,AfDB,2021,,2.5 million,agriculture,"Challenge
In Tanzania, a $2.5 million grant to Mtandao wa Vikundi vya Wakulima (MVIWATA) will increase household incomes, address nutritional challenges arising from COVID-19, and reduce post-harvest losses by developing food supply services around horticulture production areas.  
The project will revamp rural economies which have been adversely affected by COVID-19 by increasing production, marketing, and supply services on horticultural produce value chains, especially on fresh vegetables and spices and the professionalization of MVIWATA Market Companies (MMC) and rural SMEs in and around existing rural bulk markets. The project will build on the existing initiatives and experiences of MVIWATA in rural markets and consequently contribute to improving diets for coping with COVID-19 nutritional demands, climate change mitigation strategies and gender equality while attaining sustainable income generation. As a result, project activities will improve the local horticultural produce supply and unlock market failures, which have been exacerbated by the COVID-19 pandemic and the long-term climate change effects through the on-farm improvement of horticultural commodities, and market improvement in food supply services, and professionalization of the rural market companies and rural SMEs. 
Professionalization of smallholder producers’ rural SMEs and MVIWATA market companies will improve the business transactions capacity of smallholder producers to serve the sub-urban and urban consumers, bridge the food supply gap arising from the COVID-19 pandemic and enhance gender-equitable value chains while increasing institutional, national and global efforts on poverty reduction, climate resilience and building long-term solutions to food supply and security in both rural and urban areas.",,,,,,,,,,,,,,,,
Strengthening Productive Capacity and Resilience of Smallholder Sweet Potato Producer Organizations in Uganda  ,,,,,,,,Uganda,Under Preperation,Public,World Bank,2021,,2.4 million,agriculture,"Challenge
In Uganda, a $2.4 million grant to Soroti Sweet potato Producers and Processors Association (SOSPPA) will build the resilience of the rural economy and livelihoods in select regions of Eastern Uganda by improving farmers’ market access and providing processing and value-addition support while also increasing productivity and production of select crops. It will do so by increasing productivity and production of sweet potato roots and vines, and other nutritious crops, and provide improved access to the market. The project will also promote diversified utilization and consumption of potato products amongst SOSPPA members and in current and new markets. Finally, the project will strengthen the organizational capacity and professional performance of the SOSPPA to support their member farmers. 
This project will also result in better food, nutrition, and income security. The project will target 2,700 farmers, with 50% women. Moreover, 17,500 caregivers will be provided healthy baby toolkits and trained on their use to improve the feeding of potato puree and other nutritious diets (porridge). The project will harness the experiences of the Uganda Multi-Sectoral Food Security and Nutrition Project (UMFSNP) – GAFSP funded project, and other projects, and build on the ongoing Agriculture Cluster Development Project’s (ACDP) value chain development initiative.",,,,,,,,,,,,,,,,
Promotion of Gender-sensitive Agricultural Value Chains and Women's Entrepreneurship in Support of the Program to Support Agricultural Transformation in Mauritania (PCVASGEF-PATAM),PCVASGEF-PATAM,,,,,RDGN.2/LTR/2021//09/03-1/RM,,Mauritania,Under Preperation,Public,AfDB,2021,,17 million,agriculture,"Challenge
In Mauritania, an investment of US$17 million will contribute to the improvement of food and nutrition security and the living conditions of the target populations in the regions of Brakna and Trarza. The expected project objective is to increase productivity, add value to agricultural products and support the empowerment and promotion of entrepreneurship of women and girls. In order to achieve its objectives, the PCVASGEF project will emphasize the economic empowerment of women and girls and the promotion of female entrepreneurship. Specifically, the project will develop women’s market gardening areas, fodder reserves, and the construction of feeder roads, among other activities to support structural and resilient facilities. Additionally, the project will develop value chains and entrepreneurship of youth and women by constructing irrigated platforms, vegetable packaging, and storage units, help build the technical and management capacity of women cooperatives, as well as support the establishment of off-ground nursery techniques and greenhouses. 
Solution
The project will target mainly women farmers and young people who are potential entrepreneurs with innovative initiatives in the agricultural value chain. Overall, the project will benefit 22,222 households, while indirectly benefitting nearly 90,000 people, in the proposed target areas of Brakna and Trarza regions.""Food Security Support Project in Louga, Matam and Kaffrine Regions (PASA/Lou-Ma-Kaf)",,,,,,,,Senegal,Active,Public,AfDB,2012,,40 million,agriculture,"Challenge
Senegal remains one of the poorest countries in the world and is ranked 162 out of 187 countries under the Human Development Index. Although contributing only about 18% of GDP, the agricultural sector employs more than 50% of the workforce. Senegal continues to rely on rain-fed agriculture, with only 5% of the land irrigated, but subsistence rain-fed agriculture in a semi-arid zone is highly vulnerable to drought, soil degradation, and to the effects of climate change. Less than 2% of cultivated areas are irrigated, despite huge potential in surface and run-off water. 
Solution
PASA-Lou/Ma/Kaf works to improve food security, rural incomes, and resilience to climate change among three weather hazard-prone regions with nearly 2 million inhabitants and more than 3 million ruminants. Through access to water and sustainable inputs, land tenure security, and improved soil fertility, the project improves small-scale producers’, women’s, and farmers’ organizations’ access to a wide range of agricultural and livestock infrastructure. These include drip irrigation through boreholes and market gardens, mini-boreholes and wells, lowland development for rice and horticultural farming developed through the sills and anti-salt dams, and constructed or rehabilitated livestock boreholes equipped with drinking troughs. The project also strengthens mechanisms for extension services, supports advisory services in developed sites, supports the creation of jobs for youth, organizes producers (i.e. farmers and breeders), and processes and markets produce."
Agriculture Productivity and Nutrition Improvement Project (APNIP),APNIP,,,,,,,Kyrgyz Republic,Active,Public,World Bank,2012,,38 million,agriculture,"Challenge
After the collapse of the Soviet Union in 1991, the Kyrgyz Republic was an early adopter of land reform. Currently, the country’s agriculture sector is driven by small-scale irrigated agriculture and pasture-based livestock production. Two-thirds of the rural population are employed in the sector, with the average farm size less than 1 hectare and small-scale farmers owning most livestock. The majority of these rural households are dependent on crop and livestock sales for their livelihoods. However, food insecurity is high and fluctuates both seasonally and regionally, particularly among children and women. Most food-insecure households rely on a single income and have small household plot sizes and limited livestock. Adverse climatic conditions mean that irrigated agriculture has a major influence on production, rural household incomes, and, consequently, on food security. 
 
Solution
APNIP increases agricultural productivity and food security among rural households in select areas by rehabilitating irrigation and drainage infrastructure. Project-improved irrigation service delivery at farm level has enabled water users’ associations and farmers to improve water management, providing agricultural advisory services and training for improved irrigated crop production and marketing and on-farm water management. Nutrition interventions have been scaled up, including community-level nutrition awareness programs and information about improved domestic gardening to increase dietary diversity. More than one half of the targeted farm households irrigate less than one hectare of land, and 20% are female-headed households.",,,,,,,,,,,,,,,,
Expanding Rice Production Project (ERPP),ERPP,,,,,,,Tanzania,Closed,Public,World Bank,2012,,22.9 million,agriculture,"Challenge
In Tanzania, the agricultural sector is a key driver of social and economic development, generating 25% of GDP, 24% of exports, and employing over 75% of the population – particularly in rural areas where poverty and food insecurity are highly concentrated. Smallholder farming is characterized by the use of rudimentary tools like the hand hoe and reliant on traditional rain-fed cropping method and animal husbandry. Food is the principal sub-sector, dominated by smallholder subsistence farmers with 0.2 to 2.0 hectares who utilize 80% of the cultivated arable land to produce both food and cash crops. However, most farmers can only produce one crop a year because of poor irrigation infrastructure and water management.
Solution
ERPP increases rice production and marketing in targeted areas of Morogoro on the Tanzanian mainland and on Zanzibar, leading to improved rural incomes and food security, and contributes to climate change adaptation by supporting improved irrigation and water management systems. To do this, the project carries out activities to ensure sustainable seed systems, improve crop productivity through better irrigation and crop management, employ innovative marketing strategies, efforts to manage the irrigation scheme as a block, facilitate bulk purchase of inputs, and coordinate crop sales through a warehousing program. Further, the project promotes improved water use efficiency in irrigated rice production by supporting the System of Rice Intensification, which can reduce water use by up to 50 percent; supports provisions of marketing infrastructure and strengthening market linkages and information; and trains farmers on paddy post-harvest activities and marketing. Project monitoring systems evaluate the participation of female farmers in the targeted irrigation schemes and ensure that women do not lose access to land when productivity and incomes rise.",,,,,,,,,,,,,,,,
Smallholder Irrigation and Value Addition Project (SIVAP) ,SIVAP,,,,,,,Malawi,Closed,Public,AfDB,2012,,39.6 million,agriculture,"Challenge
In Malawi, one in two people in rural areas are poor – the vast majority are small-scale food producers – driven by poor performance of the agriculture sector, volatile economic growth, population growth, and limited opportunities in non-farm activities. Agriculture accounts for around 30% of Malawi’s GDP, and provides a livelihood for more than 80% of the population. The sector is composed of about two million small-scale food producers who use 6.5 million hectares of cultivable land and around 30,000 commercial estates that hold around 1.2 million hectares of cultivable land. Most small-scale food producers cultivate less than one hectare. Only 2% of Malawi’s cropland is irrigated, and almost all the irrigated land is controlled by commercial estates, which mainly grow cash crops such as tobacco, cotton and coffee.
Solution
The Smallholder Irrigation and Value Addition Project (SIVAP) increases agricultural production and productivity through the intensification of irrigation, crop diversification, value addition, and capacity building for sustainable land and water management and value chain development. The main activity, the intensification of irrigation, involves construction of 11 new irrigation schemes and rehabilitation of 5 existing schemes. It also supports the implementation of programs that address institutional and capacity  constraints through capacity building of local farmers’ organizations, water users’ associations (WUAs), and farmers’ cooperatives on production technologies, nutrition, agribusiness, and environmental management. Farmers will be trained on good farming practices including timing, planting, harvesting techniques to maximize crop potential, and nutrition.",,,,,,,,,,,,,,,,
Platform for Food Security and Rural Development of the Imbo/Mosso (PNSADR-IM),PNSADR-IM,,,,,,,Burundi,Active,Public,IFAD,2012,,30 million,agriculture,"Challenge
Nearly 70% of Burundians lives on less than US$1 a day, and those living in rural areas are the most-severely affected by poverty and food insecurity. The vast majority of the population works in the farming sector, estimated at more than 95%, and most are small farmers who depend on food crops. Their poverty is largely linked to low agricultural productivity, due in large part to the small size of farms, low soil fertility, limited technological and financial capital assets, lack of access to quality seeds and fertilizers, and a limited technical knowledge of farming best practices.
Solution
To support these farmers and help lift them out of poverty, PNSADR-IM strengthens food security and rural development in Imbo and Moso regions by reinforcing hydro-agricultural infrastructure, such as dams and roads in marshlands and plains; provides access to production areas; and develops and strengthens the rice and milk sectors. The project also supports production diversification and promotes nutrition education, while building stakeholder capacity in agricultural development.",,,,,,,,,,,,,,,,
Food and Agriculture Sector Development Project (FASDEP),FASDEP,,,,,,,The Gambia,Closed,Public,"AfDB , FAO",2012,,28 million,agriculture,"Solution
FAO classifies The Gambia as a Least Developed, Low Income Food Deficit Country, with 31.7% of the population living in extreme poverty. The agriculture sector provides employment for about three-quarters of the labor force, and smallholder farmers supply about 90% of domestically produced food. However, the sector produces low and unpredictable yields, is highly susceptibility to droughts and erratic climate patterns, and is essentially rain fed, with only 3% of the arable land estimated to be under irrigation.",,,,,,,,,,,,,,,,
Multisectoral Food Security and Nutrition Project (UMFSNP),UMFSNP,,,,,,,Uganda,Active,Public,World Bank,2013,,27.6 million,agriculture,"Challenge
Subsistence farming by Uganda’s smallholders currently accounts for 96% of all farm production and a quarter of total GDP. The sector employs more than two-thirds of workers, contributing to 40% of household income. At the same time, stunting affects one in three children—more than 2.1 million children across the country, higher than its immediate neighbors—some of whom have lower per capita income. Undernutrition disproportionately affects rural areas, where stunting rates top 36%, compared to 19% in urban areas, and annual costs associated with child undernutrition are estimated at 5.6% of GDP. Meanwhile, Ugandan agricultural policy has focused primarily on increasing productivity and commercialization of staple foods and cash crops to raise farmer incomes. 
Solution
UMFSNP increases the production and consumption of micronutrient rich foods, including African indigenous vegetables, high-iron beans, and orange-fleshed sweet potatoes, while increasing the use of community-based nutrition services in smallholder households in project areas. The focus is on promoting short-term changes in high-impact nutrition behaviors and practices that are known to contribute to the medium- and long-term reduction of stunted growth in young children. Activities include distributing start-up materials to increase household production of nutritious foods while improving nutrition and health education through schools and community-based agriculture extension and health services. Services include routinely distributing nutrition commodities, such as iron-folic acid supplements or anthropometric measurement scales, to communities in 15 project districts. The project also supports community-led school demonstration gardens, education for women’s groups, and scaling up of micronutrient supplementation.",,,,,,,,,,,,,,,,
Koulikoro Region Food And Nutrition Security Enhancement Project (PReSAN-KL),PReSAN-KL,,,,,,,Mali,Active,Public,AfDB,2013,,37.2 million,agriculture,"Challenge
In Mali, a landlocked Sahel country vulnerable to weather conditions, 77% of the population live in rural areas, and 46% are below 15 years old. The economy is largely based on agriculture –around 40% of GDP– sustained mainly by the subsistence farming and livestock sub-sectors, as well as the building and trade sub-sectors. Poverty remains an essentially rural phenomenon, and 22% of the population lived in extreme poverty in 2010, with farmers being the poorest. Overall, these people are unable to meet basic nutritional needs, with undernourishment affecting 4% of the population.
Solution
PReSAN-KL sustainably increases rice and vegetable crop production and productivity while improving incomes through water management and agricultural product development. The project focuses on increased agricultural output, infrastructure for drinking water, improved health and education, and improved capacity of local communities and authorities, professional organizations, and technical service providers. Capacity development strengthens women’s and young people’s participation and organization skills. A nutrition component helps prevent malnutrition and promote health and nutrition by preventing the resurgence of waterborne diseases; increasing and diversifying agricultural production; establishing women’s groups of culinary demonstrations; constructing, rehabilitating, and equipping health centers; improving dispensaries; and producing fortified foods and supplements made from local products.",,,,,,,,,,,,,,,,
Food Security and Agriculture Productivity (FSAPP),FSAPP,,,,,,,Bhutan,Active,Public,World Bank,2013,,8 million,agriculture,"Challenge
Bhutan is a small landlocked nation, with only 8% of arable land, only 3% of which is under cultivation, mostly by smallholder farmers. Large areas are exposed to monsoons, floods, droughts, landslides, and earthquakes. More than a third of Bhutan’s poor live in rural areas, and almost 70% of the rural population engages in subsistence farming.
Solution
In support of the government’s efforts to reduce rural poverty and high levels of malnutrition through climate-smart agriculture productivity enhancements for food and nutrition security and to increase farmers’ access to local and export markets, particularly for key high-value crops, FSAPP increases agricultural productivity and enhances market linkages in rural districts in southwest Bhutan. The project aims to enhance productivity of food crops, such as rice, maize, potato, vegetables, and pulses and possibly quinoa, citrus, apples, potatoes, and high-value crops, including spices, especially large cardamom and ginger. Key activities include strengthening producers’ groups; developing irrigation, including on-farm sprinkler and drip systems; providing improved agri-inputs and farm equipment; and supporting home-grown school feeding programs.",,,,,,,,,,,,,,,,
Smallholder Agricultural Productivity Enhancement Program (SAPEP),SAPEP,,,,,,,Republic of Yemen,Closed,Public,World Bank,2013,,36 million,agriculture,"

Solution
SAPREP activities helped build communities’ climate resilience by promoting natural resource management techniques, such as water harvesting and terrace rehabilitation in the highlands, spate irrigated agriculture in the lowlands, integrated watershed management. Developing underground cistern and wadi pits, rehabilitating wells and springs, building rooftop and other household-level water-harvesting facilities water storages, excavating ponds, and rehabilitating on-farm water harvesting for agriculture and livestock strengthened on-farm water management. 
The project provided investment to increase agriculture production and improve livelihoods and nutrition and improved technologies and practices for key horticulture crops and dairy products, leading to increased nutritional content of agricultural products, better honey quality through improved beekeeping and processing, and more-successful animal husbandry and health services. The project also introduced improved climate-resilient seed varieties, better production management of emission-intensive crops, and integrated pest and disease control technologies. 
 

",,,,,,,,,,,,,,,,
Agricultural Productivity and Food Security Project (PAPSA),PAPSA,,,,,,,Burkina Faso,Closed,Public,World Bank,2013,,37.1 million,agriculture,"Challenge
Burkina Faso has been faced with some major challenges over the years that have threatened food security in the country, from a severe drought in 2011 to an influx of Malian refugees in 2012. As a Sahelian country with 86% of its population employed in the agricultural sector, Burkina Faso is vulnerable to climate shocks, which lead to poor harvests yields, a challenging food production system, and a poor rural population, in addition to the pastoralist lifestyle that promotes competition and may lead to conflict.
Solution
PAPSA supported the government’s National Rural Sector Program by helping poor farmers increase their crop and livestock production and by expanding the volume of food products sold in rural markets. This includes activities such as improving crop production infrastructure through an additional 3,000 hectares of lowland development, 2,000 hectares of small-scale irrigation, and 800 kilometers of corridors to facilitate animal access to water resources and supporting an additional 5,000 hectares of soil conservation and 3,000 compost pits for soil restoration. The project engaged in a variety of activities to develop animal production facilities, including constructing 5,000 fattening units for cattle and sheep, improving vaccine dissemination, building farmer capacity on artificial insemination techniques for cattle, and improving milk collection and processing efforts. The project also supported the warrantage warehouse receipt system, a rural credit guarantee scheme for 500 farmers’ organizations, and post-harvest management and marketing of food products by constructing 50 community warehouses.",,,,,,,,,,,,,,,,
Sustainable Agriculture Productivity Improvement Project (SAPIP),SAPIP,,,,,,,Timor-Leste,Active,Public,World Bank,2013,,21 million,agriculture,"Challenge
Timor Leste’s agriculture sector sustains the livelihoods of 64% of the country’s labor force, but contributes to only around 10% of the economy. The unemployment rate is around 70%, while more than half of the population is under 25 years of age . Malnutrition and food insecurity are particularly pervasive in remote rural areas, often only accessible by horse or foot, and nearly all households exhaust their home-grown food supplies within nine months. These areas typically have rain-fed crop land used for unsustainable small-scale subsistence farming and large areas on steep slopes with infertile soils and are particularly vulnerable to weather shocks, like floods and off-season rains. 
Solution
SAPIP aims to improve incomes, food security, and nutrition in select areas of Timor Leste by improving country-led public sector investments to increase smallholder agricultural productivity. It also empowers farmers and links them to markets, strengthening adaptive research and extension institutions, reducing risk and vulnerability, improving rural non-farm livelihoods, and strategically deploying technical assistance. Further, the project supports municipal and watershed agriculture development planning, farm development initiatives, small-scale infrastructure and farm equipment, and the Ministry of Agriculture’s planning, financing, monitoring, and coordination functions. 
Activities focus on improved watershed management to enhance livelihoods and reduce climate-related vulnerability by improving water management and supporting commercial forestry for environmental rehabilitation. Farmer groups, associations, and cooperatives better engage women and young people. As SAPIP introduces new technologies, it plans to roll out training using the Farmer Field School model, spreading knowledge and skills on agriculture best practices and demonstrating the benefits and cost savings associated with working as a group. Additionally, the Food and Agriculture Organization of the United Nations (FAO) is supporting the government to strengthen its monitoring and evaluation functions.",,,,,,,,,,,,,,,,
