Promotion of Resilient Agroforestry in Grand’Anse: Scaling up and Professionalizing Small-Scale Initiatives to Build Back Better  ,,,,,,,PAM/HAI/PROG/0058/09-2021,Haiti,Under Preperation,Public,WFP,2021,,3.0 million,agriculture,"Solution
In Haiti, a $3.0 million grant to Réseaux des Organisations de Producteurs et Productrices de la Grand’Anse (ROPAGA) will increase smallholder farmers’ food security and resilience inGrand’Anse, one of the poorest regions of Haiti mainly active in the agricultural sector, bysupporting them to build back better and sustain farmers’ livelihoods in a post-earthquake and climate change context.  
The project intends to do so by scaling up ROPAGA’s current efforts, improving food security and resilience to climate shocks through Agroecological practices, including agroforestry techniques, improved livestock management, and beekeeping. To increase their incomes and build their resilience to climate shocks, through local production and marketing of productive and drought- and flood-resilient varieties of fruit and tubers. The project will also improve access to wider market and transformation opportunities, by linking producers to local private sector entities, as well as their access to agricultural finance and agriculture-related ventures.  by developing a line of agricultural credit that will allow farmers to make productive investments and provide sustainable revenue sources for the PO’s future self-sufficiency.  
ROPAGA’s Agroforestry and Resilience project, will work in in partnership with ActionAid and WFP to target current barriers faced by farmers in a cohesive program designed to take advantage of both the localized knowledge and community reach of local organizations and the economies of scale and opportunities of access to well-established organizations like ROPAGA and ActionAid. This project will enable ROPAGA to build on and scale-up its current efforts in two of the communes most affected by the August 2021 earthquake, and it will target 10,000 small farmers.",,,,,,,,,,,,,,,,
"Strengthening Capacities for Climate Resilience and Economic Empowerment of Rural, Smallholder Producers in the Dry Corridor  ",,,,,,,,Honduras,Under Preperation,Public,FAO,2021,,2.13 million,agriculture,"Solution
In Honduras, a $2.13 million grant to Alternative Community Economy Network (COMAL) will improve climate resilience and food security through economic empowerment and agricultural system transformation in three target areas in Dry Corridor, characterized by high poverty rates that suffered large livelihood losses due to COVID-19.   
The project will do so by focusing on developing value chains (avocado, vegetables, and honey) through agroecological approaches and improved market access, the project will build strong connections between smallholder farmers and local businesses and companies and will leverage existing relationships with dynamic markets at the national level., promoting food security and nutrition by diversifying smallholder farms and educating families about healthy food consumption. The project will bring smallholder farmers and companies together to create strategic alliances and partnerships in order to promote and sell their products. The project will also promote the financial inclusion of cooperatives and smallholder farmer organizations to strengthen territorial development. Cross organizational dialogues and advocacy around good governance will be conducted. Restoring livelihoods and local economies using a territorial development approach that includes productive and financial inclusion will improve adaptation capacities in a changing environment strongly affected by COVID-19. 
The project will employ an integrated and cross-sectoral approach to gender issues and will involve the participation of women's groups. Women will be empowered to participate and take on leadership and decision-making roles in cooperatives and organizations. Indirectly, the project addresses food and nutritional security issues, as well as offers alternatives to cross-border migration and organized violence linked to unemployment, underemployment and food insecurity.",,,,,,,,,,,,,,,,
Strengthening Producer Organizations in Kyrgyz Republic  ,,,,,,,,Kyrgyz Republic,Under Preperation,Public,"FAO , World Bank",2021,,5 million,agriculture,"Solution
In the Kyrgyz Republic, GAFSP funds totaling $5 million will strengthen producer organizations, farmers’ organizations, and agribusinesses to expand their productive and organizational capacity, improve their climate resilience, and participate in emerging agri-food clusters. GAFSP financing will support the strengthening of the existing producers' groups and facilitate their integration into selected value chains. By addressing organizational development deficiencies, linking targeted technical training and technology promotion, and improving readiness to embrace markets, groups can become more effective value-chain actors and credible partners for upstream and downstream stakeholders.     
The GAFSP financing would fill an important investment gap to complement ongoing investments in the agriculture sector, by providing targeted, catalytic funding to increase the capacity of farm and producer organizations to maximize their limited resources and better participate in value chain opportunities. The project will target a range of groups or associations operating within the dairy and horticulture value chains, which the Government has identified as the most in need of more organized producer associations. These value chains represent the highest potential for growth and resilience building, their nutritious products are not consumed in adequate quantities, and where the need for more organized producer associations with a special focus on women and youth is most acute.",,,,,,,,,,,,,,,,
Agriculture for Nutrition – Phase 2 (AFN II),AFN II,,,,,,,Lao PDR,Active,Public,"IFAD , WFP",2021,,17 million,agriculture,"Solution
In Lao People’s Democratic Republic, $17 million in GAFSP funding will improve and diversify vulnerable communities’ nutritional and socio-economic situations, adopt gender-transformative practices, build resilience to climate conditions, and improve production and marketing capacities.  
The AFN-II builds on the lessons learned and the achievement of the first phase project. AFN-II project interventions will continue to focus on the implementation of the four nutrition-sensitive agricultural activities within the 23 priority interventions under the new “National Plan of Action on Nutrition” (NPAN) 2021-2025. The project will specifically empower women to sustainably achieve better household nutrition outcomes, particularly for pregnant women and lactating mothers and children up to the age of 5 years, through the implementation of nutrition-sensitive agriculture interventions and sustainable management of the available natural resources in the communities. This will be achieved through the implementation of three interlinked project components. 
The project will have three interlinked components aimed at addressing the sustainable, inclusive, and resilient recovery of the country’s agriculture and food systems in the context of the ongoing COVID-19 pandemic, namely: (1) Community-driven agriculture and nutrition interventions promoting the use of natural resources; (2) Business Partnerships and Market Access improvement; and (3) Enabling environment.",,,,,,,,,,,,,,,,
Strengthening Agribusiness Producer Organizations in the Maldives through Enterprise Ecosystem Development and Deployment of Digital Solutions ,,,,,,,,Maldives,Under Preperation,Public,FAO,2021,,2.64 million,agriculture,"Solution
In the Maldives, a $2.64 million grant to Addu Meedhoo Cooperative Society (AMCS) will develop economically viable PO members, empowering them to take a stronger role in the agriculture value chains of the country. The project aims to do so by strengthening the governance and managerial capacity of AMCS and PO members and developing PO Enterprises. This will result in a resilient and robust food system, help overcome the severe impacts of climate change, and help build back better from the impacts of COVID-19. The project will use climate-smart technologies to reduce the use of soil and environment degrading agricultural practices, cut down on food wastage and maintain the nutrition quality of harvested products. Through a partnership with island-level schools, health centers and NGOs, the project will conduct nutrition outreach sessions and support school garden programs. It incorporates a performance-based approach to strengthen entrepreneurial skills to create a thriving and robust ecosystem of POs, enabling their medium to long-term sustainability. The project will ensure that more women farmers take a leadership role in the management and governance of farmer organizations in their respective island communities. The PO will also work with academic institutions for policy research, assessments and surveys to be used in the policy formulation process. 
Working on 16 islands, the project will benefit about 3,500 farmers and 18,550 people with improved nutrition and food security.",,,,,,,,,,,,,,,,
Vegetables in Hilly Areas Project ,,,,48218-006,,,,Nepal,Under Preperation,Public,"ADB , WFP",2021,,12 million,agriculture,"Solution
In Nepal, an investment of $12 million will improve the livelihoods and food security of poor households in targeted communities and enhance their access to agriculture markets and financial services.  
The key results from the project would include: (i) household income from horticulture production increased; (ii) linkages to markets and financial services improved; (iii) dietary diversity among women in participating households increased, and (iv) resilience of farmers to climate change improved.  
The project will support poor households with less than 4 ropani (0.2 ha) of agricultural land particularly, women-headed households, women within poor households, and ethnic women, for the development of irrigated OSV production. The project will be implemented in 100 municipalities across 5 provinces that have been selected for their suitability for horticulture development and access to the Mid-Hills highway and its north-south feeder roads. Ethnic people form approximately 30% of the population in the targeted municipalities, are often poor and would be proportionally represented in the project. At least 60% of the people benefitting will be women, who, along with other family members, including youths, will be supported to organize in various ways to better access technical and nutritional knowledge, and crop inputs, finance, and markets.  
The project will be aligned with the planned US$83 million ADB-financed Nuts and Fruits in Hilly Areas (NAFHA) project. Activities to be implemented under the GAFSP grant are organized under the following three components: 1) farmer identification, capacity building, and organization; 2) smallholder farmers’ out-of-season vegetable production and beekeeping increased; and 3) market access enhanced.",,,,,,,,,,,,,,,,
"Resilient, Inclusive, and Transformative Recovery of Small Farmers, Women, Youth and Indigenous People in the Dry Corridor of Nicaragua ",,,FAOR/LC/FD/120/2021,,,,,Nicaragua,Under Preperation,Public,FAO,2021,,3.21 million,agriculture,"Solution
In Nicaragua, a $3.21 million grant to the National Union of Farmers and Ranchers (UNAG) will increase agricultural income and food security for smallholder farmers and aid recovery from COVID-19 impact in selected areas of the Dry Corridor. The specific objectives are to increase agricultural productivity and improve the use of natural capital through the adoption of sustainable production, access to the market as well as greater access to complementary value-chain services including finance. 
The project will do so specifically by strengthening the PO members through capacity assessment, participatory strategic development, and training. It will also increase the resilience and productivity of agricultural and livestock-raising systems, promoting sustainable and climate resilient production through farmers’ training, biointensive gardens and nutrition, irrigation, and other sustainable agricultural practices. Finally, the project will promote economic opportunities for members of cooperative organizations affiliated with UNAG, with emphasis on young adults, women, and indigenous, providing access to information, financing, and markets, including activities in favor of women and youth. The project will be implemented over a three-and-a-half-year period. UNAG will be in charge of implementation through 192 affiliated Producer Organizations (PO) in 14 municipalities. The target population is 10,000 farmers, all of whom are organized in cooperatives and associations affiliated with UNAG. The intervention will focus on the provinces of Matagalpa, Estelí, and Madriz, specifically on 14 municipalities and directly benefiting 4,369, of which 43% are women, 27% youth, and 13% indigenous.",,,,,,,,,,,,,,,,
Strengthening Farmers’ Organizations to Develop Sustainable Livelihoods ,,,,,,,,Niger,Under Preperation,Public,FAO,2021,,2.71 million,agriculture,"Challenge
In Niger, a $2.71 million grant to Fédération des Unions de Groupements Paysans du Niger (FUGPN-Mooriben) will improve the income, food security, and nutrition by strengthening grassroots POs and their unions, emphasizing women and youth as drivers of economic and social development.  
This project will carry out activities with a particular focus on capacity building related to responsible investment in agriculture and food systems, which includes improving farmers' organizations' access to value chains and financing. In particular, Mooriben will help strengthen farmers' capacities to invest and benefit from investments and to manage and undertake sustainable and resilient income-generating activities. To this end, the project will bring innovative technologies and an inclusive approach and will seek to support quality food system products that are competitive in local and national markets. Furthermore, it will seek to create and support employment for women, particularly young girls who are experiencing high migration to large urban centers. 
The project seeks to strengthen the capacity of POs so that they can help their members integrate the various linkages in the value chains, with respect for transparency, inclusion, and participation, particularly among women. The project will also enable FUGPN-Mooriben, the leading PO; to strengthen all participating POs members through a series of modules that will include a core curriculum on organizational management, leadership, governance, negotiations, financial management, accounting, and communications.  
Through this project, FUGPN-Mooriben will help each Union/PO to identify its own value chain initiative to undertake as an organization using the FAO inclusive value chain development approach or to improve initiatives currently being implemented by Unions or POs, particularly those focused on technological innovation and improving market access. Special attention will be given to women and youth who have fewer opportunities to access productive assets.",,,,,,,,,,,,,,,,
"Support to the Improvement of Rural Family Poultry Farming in Departments of Mbour, Fatick and Kaolack ",,,,,,,,Senegal,Under Preperation,Public,IFAD,2021,,2.29 million,agriculture,"Solution
In Senegal, a $2.29 million grant to National Council for Concertation and Rural Cooperation (CNCR) will increase the income of young entrepreneurs and their families' food and nutrition security by increasing agricultural productivity and strengthening poultry Producer Organizations. The project will do so by increasing productivity and family poultry production sustainably, to remove the genetic, health, food, technological and organizational constraints, resulting in increased village poultry productivity while also improving marketing and institutional strengthening of poultry producer organizations. For instance, by supporting the establishment of small formalized rural poultry businesses and providing technical and managerial capacity building for young women and men village poultry entrepreneurs, Other activities include facilitating access to basic investments, working capital, and poultry inputs; facilitating animal health services and breeding advice support; supporting the installation of small poultry feed manufacturing units based on local raw materials in the project intervention area. By developing poultry, which is a short cycle activity that can be repeated several times in a year, it is possible to support rebuilding the asset base of the rural economy. The project will build on the achievements of previous initiatives that developed poultry habitat models and strengthened the capacities of poultry farmers. The project considers family farms as the target population and will support up to 1,400 young women (75 percent) and men (25 percent) village poultry entrepreneurs, aged 20 to 35.",,,,,,,,,,,,,,,,
Post-COVID Food and Nutrition Security Enhancement Project (PRESAN/PC) ,PRESAN/PC,,,,,ADB/BD/WP/2022/208/,,Senegal,Under Preperation,Public,AfDB,2021,,20 million,agriculture,"Solution
In Senegal, GAFSP funds totaling $20 million will enhance food and nutrition security and increase smallholder farmer incomes in five targeted regions. Specifically, the project will (i) improve the income and building the food and nutrition security of small farmers, through water management, increased productivity sustainable development of plant and animal productions, (ii) provide private sector development opportunities, in line with investment plans to support national efforts for medium- and long-term response to COVID-19 and resilience to climate change. 
Through its main three components, the project aims to achieve results by building sustainable hydro-agricultural and pastoral infrastructure and supporting production and capacity building. The project covers the 5 administrative regions of Louga, Matam, Kaffrine, Kaolack, and Tambacounda. From north to south, the 5 regions cover two agro-ecological zones of Senegal: the silvopastoral zone and the peanut basin. Furthermore, compared to the three regions covered by PASA LouMa-Kaf, the districts of Nioro and Koumpentoum are the extension area of the project when it comes to the new regions.  
The project’s priority targets will be local small farmers, youths and women, and people with disability living in the project’s 5 intervention regions. Emphasis will also be laid on the most vulnerable groups, including women, youths, and the elderly. Overall, nearly 40,000 farmers and other target populations will be directly impacted by the project, including over 24,000 women (60% of the project target) and about 12,000 youths (30% of the project target).",,,,,,,,,,,,,,,,
Agricultural Investment for Markets and Nutrition in Solomon Islands and the Republic of Vanuatu ,,,,,,,,Solomon Islands,Under Preperation,Public,"FAO , IFAD",2021,,15 million,agriculture,"Solution
In the Solomon Islands and Vanuatu, GAFSP funds totaling $15 million will support a multi-country project to improve nutrition and increase farm incomes from resilient farming systems in rural communities.  
The project will support the Governments of the Solomon Islands and Vanuatu to implement selected elements of their agriculture sector investment plans and COVID response measures that directly contribute to the sustainable, inclusive, and resilient recovery. The project addresses the three inter-related problems of poor nutrition, low farm incomes, and the vulnerability of local agri-food systems to shocks which include pandemics, natural disasters, and climate change. The project will develop the capacity of the extension services in both countries to more effectively reach out to small farming communities through teams of locally recruited community facilitators. The extension services will partner with service providers, often NGOs, with a proven track record in community mobilization and in value chain facilitation. Capacity will also be developed for producer groups.  
Value chains will be strengthened through partnerships between producer groups and private businesses. Interventions will address institutions (networks, partnership agreements, flow of information including use of digital technology) and hardware (e.g. processing, storage, and small-scale transport or market infrastructure). Project-funded investments of the producer groups are expected to create a conducive environment for investment by the private sector partners. By itself, the production of perishable produce for urban markets cannot sustain adequate farm incomes for many island communities. While the project will focus on nutritious food crops and small livestock, the project will also invest in the production and marketing of cash crops in order to encourage sustainable practices and enhance the self-reliance and resilience of private farmers.  
The project adopts a community-driven approach based on experiences across the Pacific demonstrating the importance of alignment with traditional social practices, collective decision-making, and shared interests of targeted households. Addressing the social structure of production (including land and labor allocation, which is influenced greatly by community leaders) has proven invaluable for social inclusion, including access and targeting of women and youth as well as poorer or more disadvantaged households. This strategy will be implemented through three inter-dependent components, focused respectively on community action, capacity building, and investments.",,,,,,,,,,,,,,,,
Rural Enterprises for Agricultural Development (READ)  ,READ,,,,,,,South Sudan,Under Preperation,Public,IFAD,2021,,20 million,agriculture,"Solution
In South Sudan, $20 million in funding will enhance the capacity of Producer Organizations to improve social cohesion and serve as effective value chains actors and partners.  
The project aims at responding to critical growth and development challenges confronted by smallholders by supporting the development of rural producers’ organizations as effective value-chain actors and credible partners. The READ project aims at fostering the holistic development of rural producers’ organizations, by promoting good governance and accountability systems vis-à-vis their constituencies, enhancing their sustainable business models and economic initiatives and strengthening their capacity to provide services to farmers including facilitating access to financial services, technology, inputs and markets. READ also aims to contribute to the peace, recovery and stabilization agenda by strengthening the social fabric within communities and creating livelihood opportunities for the rural population, including returnees and IDPs. READ will be implemented through a conflict sensitive lens, whilst ensuring inclusion and empowerment of youth and women. 
READ will invest in differentiated approaches to capacity development of existing rural people’s institutions with the aim of promoting farming as a business. It will do so through a holistic approach for RPOs development, supporting existing formalized organizations such as cooperatives, and adopting a graduation approach for the less structured Agriculture Producers’ Groups (APGs), including women and youth groups, to equip them with assets and capacities needed to promote equitable and sustainable market linkages for rural producers. Women’s empowerment will be central in the project – given women’s prominence in the agriculture sector and their marginal role in decision-making processes, at household, community and at interest groups levels. Project support will place a deliberate focus on economic activities that are capable of improving the nutritional status of RPO members and their households, while strengthening their resilience and adaptation to climate change. 
The project will invest in the development of inclusive rural financial services, to ensure the RPOs supported have access to long-term viable financial services beyond the READ project period. This will consist, in the target areas, support to Savings and Credit Cooperative initiatives deepening access to credit for agriculture through a partnership with the Cooperative Bank of South Sudan. Furthermore, the project will support effective implementation of the relevant policy frameworks regulating the cooperative sector and rural financial inclusion.",,,,,,,,,,,,,,,,
