Resilience and Nutrition in Great Lakes Region (RENUGL),RENUGL,,,,,,,Democratic Republic of Congo,Under Preperation,Public,"FAO , World Bank",2019,,15 million,agriculture,"Challenge
More than half of the DRC’s population is affected by poverty. Between 2017 and 2018, the number of people in food crisis increased from 7.7 million to 15.6 million. In 2018, the situation deteriorated, with more than 3.7 million children suffering from acute malnutrition, including 1.7 million children with severe acute malnutrition. South Kivu is the most-affected region, with a dramatic 30% rate of global acute malnutrition. The causes of malnutrition are recurrent conflict and insecurity; inadequate dietary intake, especially among women of childbearing age and children; lack of production and access to nutritious and diversified food throughout the year; extremely low income; high social vulnerability of women and girls; recurrence of diseases; poor health, hygiene, and access to water; and poor childcare practices.
Solution
Within this context, RENUGL aims to sustainably improve the nutrition and resilience of the most-vulnerable populations in the South Kivu-Tanganyika corridor through initiatives that strengthen social cohesion, community empowerment, livelihoods, and entrepreneurship and develop nutrition-sensitive agriculture activities.",,,,,,,,,,,,,,,,
Small Islands Food and Water Project (SIFWaP),SIFWaP,,,,,,,Federated States of Micronesia,Under Preperation,Public,"FAO , IFAD",2019,,12 million,agriculture,"

Challenge
The Federated States of Micronesia, Kiribati, the Republic of the Marshall Islands, and Tuvalu are among the smallest, most-isolated, and most-fragile of Small Islands Developing States. In recent decades, cheap non-nutritious imports, such as rice, noodles, bread, and sugar, have become readily available and slowly replaced traditional crops, which are more difficult to grow and cook. As a result, populations have become more reliant on these imports and traditional diets have changed, leading to severe deterioration in health and nutrition statuses. In particular, the prevalence of nutrition disorders is escalating, with high levels of stunting in children, overweight/obesity in adults, and non-communicable diseases, including hypertension and diabetes.
Solution
Against this backdrop, SIFWaP seeks to improve food, nutrition, and water security and livelihood opportunities in the small island communities by investing in community-, group-, and household-level projects. The project will sensitize communities to diagnose, prioritize, and implement activities that improve agricultural systems and ensure the production and availability of local, nutritious foods; mainstream climate change adaptation measures into agricultural production activities to increase climate resilience; and develop an enabling policy framework to address food, nutrition, and water security.  

",,,,,,,,,,,,,,,,
Smallholder Agriculture Development for Food and Nutrition Security (SADFONS),SADFONS,,,,,ADB/BD/WP/2021/79/,,Liberia,Active,Public,"AfDB , FAO",2019,9.08 million,8.2 million,agriculture,"Solution
SADFONS aims to improve food and nutrition security and reduce poverty among the targeted rural population in the counties of Grand Gedeh, Grand Kru, River Gee, Maryland, Bomi, Bong, Montserrado, Sinoe, Grand Bassa, River Cess, and Grand Cape Mount. Focusing on food crops, such as rice, cassava, and vegetables, the project supports smallholder farmers with value addition, market access, and improved income through increased agricultural productivity and production and strengthens the capacities of government institutions, farmers, and producer organizations. The project objectives fully align with and support the Liberia Agricultural Sector Investment Program II for 2018–2022 (LASIP II) development priorities.",,,,,,,,,,,,,,,,
Food Security Response and Resilience Project,,P176129,,,,,,Republic of Yemen,Under Preperation,Public,World Bank,2019,,20 million,agriculture,"Solution
In recent years, Yemen has experienced severe political, societal, economic, and security shocks. Access to basic services, such as food and economic livelihoods, are still very limited. Yemen imports up to 90% of its food, despite the fact that 70% of its population lives in rural areas and depends on agriculture for their livelihoods. Further, Yemen inordinately suffers from the detrimental effects of climate change and communities face recurring cycles of destructive droughts and flooding. Building off the ongoing SAPREP project, SAPREP+ aims to reduce poverty and food insecurity in the seven governorates that are most vulnerable to and worst hit by Yemen’s ongoing humanitarian crisis, particularly among women and marginalized groups, through sustainable improvements in livelihoods, nutrition, and resilience of rural households in target communities, achieved by increasing agricultural productivity, market access, and smallholder farmers’ incomes and by promoting better diet and nutrition practices.",,,,,,,,,,,,,,,,
The Gambia Agriculture and Food Security Project  ,,,,,,,,The Gambia,Active,Public,AfDB,2019,,16 million,agriculture,"

Solution
This project aims to structure food demand to assure institutional markets and improve smallholder productivity, thereby increasing food and nutrition security and household incomes, particularly for vulnerable household. The project will do this by increasing agriculture production and productivity, post-harvest management and commercialization, and resilience for identified food chains; linking smallholders to assured institutional markets for example home-grown school feeding; boosting private sector participation; and promoting social protection and food safety net programs.

",,,,,,,,,,,,,,,,
Rural Productivity and Connectivity Program with a Territorial  Approach ,,,,,,,,Haiti,Active,Public,"FAO , IDB",2019,,14 million,agriculture,"Challenge
Agriculture plays a dominant role in the Haitian economy. In 2019, it was contributing about 22% of GDP, accounting for around 50% of overall employment, 66% of employment in rural areas, and 75% of employment in low income households. In rural areas, 88% of individuals live below the poverty level and more than half earn less than $1 a day. Over one million families own mainly small-scale subsistence farms, with an average farm size less than one hectare. The main agricultural crops include maize, tubers, mangoes, coffee, avocados, citrus, rice, sorghum, beans, cocoa; of which mangoes, coffee, cocoa, together with essential oils, represent the main Haitian exports. Producers typically use outdated and ineffective technologies in terms of planting materials, soil conservation or pest management techniques, and hardware is limited to hand tools – resulting in low farm income levels, land degradation, increased vulnerability of farmers to natural hazards, and also food insecurity.
Solution
The project aims to increase agricultural income and food security for smallholder farmers in select areas of Haiti by increasing agricultural productivity and improving the use of natural resources through the adoption of sustainable production and post-harvest and processing technologies and through greater access to complementary value chain services. This will enable a more efficient use of resources, will provide higher outputs, and when paired with improved capacities to access markets, will contribute to increase agricultural income. Higher food production and income together with improved knowledge on nutritious diets and other best practices will facilitate households making consumption decisions on goods and services that improve food and nutrition security.",,,,,,,,,,,,,,,,
Rural Productivity and Connectivity Program with a Territorial Approach (PAPAIR),PAPAIR,,,,,,,Haiti,Active,Public,"FAO , IDB",2019,,not found,agriculture,"Challenge
In Haiti, agriculture contributes about 22% of GDP, accounting for around 50% of overall employment, 66% of employment in rural areas, and 75% of employment in low-income households. Agri-producers typically use outdated and ineffective planting materials and soil conservation and pest management techniques, and hardware is limited to hand tools, resulting in low farm income levels, land degradation, increased vulnerability of farmers to natural hazards, and food insecurity.
Solution
The project aims to increase agricultural income and food security for smallholder farmers in select areas of Haiti by increasing agricultural productivity and improving natural resources use through the adoption of sustainable production and post-harvest and processing technologies and through greater access to complementary value chain services. This will enable more efficient use of resources, providing higher outputs. When paired with improved capacities to access markets, this support will contribute to increased agricultural income. Higher food production and income together with improved knowledge of nutritious diets and other best practices will facilitate households in making consumption decisions on goods and services that improve food and nutrition security.",,,,,,,,,,,,,,,,
Accelerating Economic and Social Inclusion of Smallholder Farmers in Climatic Hotspots through Strong Producers’ Organizations (ACCESS),ACCESS,,,,,,,Bangladesh,Under Preperation,Public,FAO,2021,,3.26 million,agriculture,"Solution
In Bangladesh, a $3.26 million grant to Sara Bangla Krishak Society (SBKS) will improve the livelihoods of smallholder farmers in climatic hotspots and strengthen their resilience to public health and climate-induced crises in targeted areas. SBKS, in collaboration with FAO, intends to scale up and build on the successful experience of the GAFSP Missing Middle Initiative (MMI) in Bangladesh to strengthen producers’ organizations (POs) and ensure their access to markets, and access to finance. The new project will broaden the farming community SBKS by supporting the establishment of new POs in three of the most climate change affected areas of Bangladesh with potential for the growth of the agri-business sector. These PO are expected to become commercially viable actors in their respective value chains as the project will support in building their institutional capacity and governance processes and will guide their integration into their local value chains.  The project will also aim to support the POs’ access to community-based financing through the development of revolving loan funds, as well as linkages with external financial providers to crowd in additional finance. As a result, the POs will be able to make investments to uplift their families and communities, helping to recover from shocks brought about by the pandemic and to be more resilient to potential future climate-induced and public health shocks. 
Recognizing the strength of women leaders within the current SBKS network, it will promote women have opportunities for leadership in their communities. The new project will also be an opportunity for SBKS to continue building its capacity to serve smallholder farmers in Bangladesh, in partnership with the private sector and government. The project will build on lessons learned under the MMI experience so that it can effectively partner with and empower more farmers throughout the country, to not only respond to the impact of the COVID-19 pandemic, but to potential future shocks, particularly related to climate change and public health.",,,,,,,,,,,,,,,,
Diversified Resilient Agriculture for Improved Food and Nutrition Security (DRAIFNS),DRAIFNS,,,,,,,Bangladesh,Under Preperation,Public,"FAO , IFAD",2021,,20 million,agriculture,"Solution
In Bangladesh, GAFSP funds totaling $20 million will help improve the food security of smallholder farmers and promote sustainable, inclusive, climate-resilient, and nutrition-sensitive agriculture practices. The project aims to contribute to the public investment priority of achieving food security and promoting sustainable, inclusive, climate resilient, and nutrition-sensitive agriculture in Bangladesh, and responding to the government’s strategy of restoring and developing the agricultural supply chain in aftermath of the COVID-19 crisis by minimizing the impact of COVID-19 for smooth agriculture growth and ensuring food security after the crisis.  
This proposed project will be implemented over four years in line with the government’s agriculture and food security development agenda as described in the Eighth Five-Year Plan (07/2020-06/2025). It will invest in restoring and developing agriculture productivity and diversification capacity as immediate reactions to the COVID-19 crisis and subsequently invest in strengthening the basis for a more sustainable and nutrition-sensitive food system after the crisis, with a focus on “building back better”. The project implementation will follow the Government DPP for approved donor-assisted project design reports; it will target the vulnerable men and women living in three climate hotspots identified in the Government’s Delta Plan, by taking the farmer groups as entry points to reach out to the vulnerable women, youth, ethnic groups among other target segments. Detailed design will elaborate a community-driven development strategy that operates on the principles of transparency, participation accountability and enhanced local capacity, making optimal use of the in-place mechanisms and instruments such as multi-stakeholder platforms, farm groups’ capacity building, focus training for women, and AWPB process. Adequate human and financial resources will be allocated to support the capacity-building needs of target groups. 
As a result, the project will help increase the availability of diversified, nutritious, safe and demand-driven agri-foods by increasing agriculture productivity and sustainable production of crops, farmers’ capability and income, efficient technology and technical services, and sustainable management of natural resources, persons receiving services promoted or supported by the project, beneficiaries of Climate-Smart Agriculture (CSA). The project will also enable an agribusiness environment for public-private partnership, with improved post-harvest management and efficiency of market access, increased volume of agricultural production processed by post-harvest facilities, and increased sales and profit.",,,,,,,,,,,,,,,,
Building Resilient Commercial Smallholder Agriculture,,,,,,,,Bhutan,Under Preperation,Public,"IFAD , WFP",2021,,13 million,agriculture,"Solution
In Bhutan, $13 million in funding will commercialize the value chains of select agriculture commodities to contribute to post-COVID-19 economic recovery and the development of resilient food systems.  
This project will build upon existing programs in Bhutan that have successfully supported the production and commercialization of agriculture. Including the GAFSP-supported Food Security and Agriculture Productivity Project (FSAPP). The project will directly address systemic barriers in the agriculture sector; and post-COVID challenges and priorities identified in Bhutan’s Renewable Natural Resources (RNR) Strategy, and food self-sufficiency policy. The project will work through an inclusive value chain development approach to address the gaps between producers, traders and consumers that are posing a challenge to the sustainability and resilience of Bhutan’s food and farming systems. The interventions will focus on commercialization and diversification of farm systems; strengthening of existing value chains (VCs) and development of new ones; and financing enabling small-scale infrastructure (on-farm water and soil conservation, aggregation centers, cold storage, milk chilling centers etc.). Additionally, the project will also support post-harvest processing and ensuring products meet internationally recognized food standards; capacity building and support to youth, cooperatives and other producer organizations for climate resilience agriculture practices, the establishment of youth enterprises for provision of organic inputs (biochar, soil stimulants, bio-fertilizer and bio-pesticides); and facilitating business linkages between producers, buyers, financiers, and local public stakeholders through multi-stakeholder platforms (MSP) and business interactions meetings (B2B) to meet local, national, regional and global consumer demand. 
The project aims to boost equitable employment and income-generating opportunities for smallholder women, men and youths through capacity building and investment support to small-holder farmers on production, marketing, and better access to services for engaging in profitable value chains as vegetables, dairy, livestock, poultry and high-value crops. In doing so, the project will seek to stimulate post-COVID19 employment opportunities for women and youth, the adoption of climate resilient and market-oriented nutritious food products and facilitate inward investment for the production and marketing of high-quality and high-value home-grown Bhutanese agricultural products. Lessons from the FSAPP (the first GAFSP project) and good practices from CARLEP will be built into the proposed project for increasing impact.",,,,,,,,,,,,,,,,
Supporting Small-scale Family Farmers who are Members of CAPAD Cooperatives in Burundi to be Resilient to the effects of the COVID-19 Pandemic,,,,,BDDI-CAPAD,,,Burundi,Under Preperation,Public,IFAD,2021,,2.34 million,agriculture,"Solution
In Burundi, a $2.34 million aims to support small family farmers who are members of CAPAD cooperatives to be resilient against the effects of the COVID-19 pandemic, while sustainably improving their income and food security. The project aims to do so by supporting the quantitative and qualitative increase in the supply of multipurpose bananas and their marketing and developing the capacity building of cooperatives in support of the marketing of products. 
The banana sector was selected for this project because it is the most commercialized agricultural production in volume and value, representing 14 percent of Burundi’s GDP and 38 percent of agricultural GDP, and involving more than 1,300,000 farm households. The development of semi-industrial and industrial processing and the recent strengthening of inter-professional cooperation between the sector’s actors (producers, processors and traders) will stimulate wealth creation along the value chains. The project will target Moso, one of the areas most affected by the pandemic in Burundi, and where socio-economic recovery is slow to take hold. The activities will focus on nine CAPAD cooperatives and their over 4,800 members, including small and medium-sized family farmers bananas producers 52 percent of whom are women, affected by the effects of the COVID-19 pandemic. The project will provide market opportunities and income to banana producers, who currently face difficulties in exporting and selling their produce on the local market. It will strengthen the operational capacity of cooperatives in the region to provide better economic and commercial services to their members. The investment in strengthening the resilience of producers is justified by the existence of market opportunities for banana juice and the presence of the banana juice processor (SOCOPA) located in the project area. SOCOPA plans, through additional investments, to double its production capacity by 2022 in certain markets, such as that natural gas and non-gas banana juice, coveted for their nutritional qualities. Negotiations/discussions are also underway with the World Food Programme (WFP) to promote the consumption of these banana juices in school canteens, through WFP’s school feeding program.   
The project will introduce new types of plant material, such as banana plants, multi-purpose varieties, allowing the production of bananas for juice or cooking banana, and varieties producing a fruit rich in vitamin A. To ensure wider dissemination of the new varieties, the project collaborates with private sector partners to multiply the variety in laboratories.  
The interventions of the cooperatives involved will, improve in the governance of the cooperatives and increase the efficiency of the banana sector in a cooperative spirit, favorable to the producers, resulting in smallholder farmers' income increase.",,,,,,,,,,,,,,,,
Building Back Better: Organic Agriculture for Smallholder Farmers in Northern Cambodia,,,,,,,,Cambodia,Under Preperation,Public,WFP,2021,,1.79 million,agriculture,"Solution
In Cambodia, a $1.79 million grant to Cambodian Agriculture Cooperative Corporation Plc. (CACC) will support smallholder farmers’ recovery from COVID-19 in the most impoverished provinces of the country, by developing value chains and improving food security and nutrition.  
The project will do so by supporting boosting smallholders’ income, the majority of whom are female and members of ethnic minorities, and their business acumen by incentivizing them to switch to an increasingly profitable organic farming model relying on a growing market and supported by an integrated value chain. 
The activities will also focus on providing access to credit via low-interest loans and the establishment of a traceability system and marketing. Finally, there will be a focus on enhancing nutritional outcomes through social and behavior change communication on nutrition and life skills for women of reproductive age. The project will be implemented over four years 
The investment is justified as following the pandemic the market for organic food, has further grown in response to heightened consumer demands for safe and healthy food. Prices of organic commodities are higher and more stable than traditional commodities, thus creating opportunities for higher margins and steadier sources of income.  
This project is a partnership between the Cambodian Agricultural Cooperative Cooperation Plc. (CACC) and the World Food Programme (WFP). CACC is an innovative Public-Private-Producer Partnership (P4) joint venture that brings together different actors of the organic value chain including private sector companies and 36 independent producer organizations and the Preah Vihear Meanchey Union of Agricultural Cooperative (PMUAC), which together represent a total of 5,462 farmers, 65% of whom are female. CACC aims to empower smallholder farmers to increasingly benefit from greater value chain participation and empower them to evolve from suppliers to entrepreneurs.",,,,,,,,,,,,,,,,
Support Project for the Promotion of Agricultural Entrepreneurship and Food Security for Local Producers’ Organizations in the DRC,,,,,,,,Democratic Republic of Congo,Under Preperation,Public,IFAD,2021,,1.65 million,agriculture,"Solution
In the Democratic Republic of Congo, a $1.65 million grant will sustainably improve smallholder farmers’ income and food security affected by the COVID-19 and climate change crises, by supporting COPACO-PRP members in developing the cassava and maize value chains in five targeted agricultural production basins, suppliers of agricultural food products for the city of Kinshasa.
The project will do so by strengthening agricultural production and processing units and by developing a partnership with agricultural research institutions, financing institutions, and market sector actors. It will also enhance the capacity building of national and local producer organizations'  leaders and support local PO entrepreneurship in the development of the cassava and maize value chains and sector structuring.
The project will target five agricultural production basins of the DRC: Plateau de Batéké in Kinshasa, Kasongo-Lunda and Kenge in Kwango, Bulungu and Masi-Manimba in Kwilu and Muanda in Kongo Central. These five areas have been chosen by COPACO-PRP according to accessibility, a climate favorable to crop production, anticipated annual production volumes, and the presence of active local POs.
Building on lessons learned from former and on-going projects, proposed activities support enhancing of collective economic actions at local PO level, while strengthening specific institutional and technical support capacities of the lead PO. This project primarily targets 20 active cassava and maize local POs, member of COPACO, to sustainably improve the income and livelihoods of 4,544 individual agricultural producers, of which 60% are women and 36% are youth.",,,,,,,,,,,,,,,,
